{"$schema":"https://json-schema.org/draft/2020-12/schema","title":"Concept Atlas record","type":"object","required":["id","clusterId","name","problem","mechanism","solutionFamily","transferRule","confidence","origin","costs","sources","examples","counterexamples","assessment","languageSupport"],"properties":{"id":{"type":"string","minLength":1},"clusterId":{"type":"string","minLength":1},"name":{"type":"string","minLength":1},"problem":{"type":"string","minLength":1},"mechanism":{"type":"string","minLength":1},"solutionFamily":{"type":"string","minLength":1},"transferRule":{"type":"string","minLength":1},"confidence":{"type":"string","minLength":1},"origin":{"type":"object","required":["summary","confidence","sources"],"properties":{"summary":{"type":"string","minLength":1},"confidence":{"type":"string","minLength":1},"sources":{"type":"array"}}},"costs":{"oneOf":[{"type":"string","minLength":1},{"type":"array","minItems":1},{"type":"object","minProperties":1}]},"sources":{"type":"array","items":{"type":"string","pattern":"^https?://"},"minItems":1},"examples":{"oneOf":[{"type":"string","minLength":1},{"type":"array","minItems":1},{"type":"object","minProperties":1}]},"counterexamples":{"oneOf":[{"type":"string","minLength":1},{"type":"array","minItems":1},{"type":"object","minProperties":1}]},"assessment":{"type":"object","required":["prompt","rubric"],"properties":{"prompt":{"type":"string","minLength":1},"rubric":{"oneOf":[{"type":"string","minLength":1},{"type":"array","minItems":1},{"type":"object","minProperties":1}]}}},"languageSupport":{"type":"object","required":["C","C++","Rust","Zig","Java","C#","Kotlin","Swift","Go","Python","JavaScript","TypeScript","Dart","Ruby","PHP","Haskell","OCaml","Erlang/Elixir","Lisp/Clojure","Smalltalk","Prolog","APL/J","Forth","SQL","Ada","Scala"],"properties":{"C":{"$ref":"#/$defs/languageCell"},"C++":{"$ref":"#/$defs/languageCell"},"Rust":{"$ref":"#/$defs/languageCell"},"Zig":{"$ref":"#/$defs/languageCell"},"Java":{"$ref":"#/$defs/languageCell"},"C#":{"$ref":"#/$defs/languageCell"},"Kotlin":{"$ref":"#/$defs/languageCell"},"Swift":{"$ref":"#/$defs/languageCell"},"Go":{"$ref":"#/$defs/languageCell"},"Python":{"$ref":"#/$defs/languageCell"},"JavaScript":{"$ref":"#/$defs/languageCell"},"TypeScript":{"$ref":"#/$defs/languageCell"},"Dart":{"$ref":"#/$defs/languageCell"},"Ruby":{"$ref":"#/$defs/languageCell"},"PHP":{"$ref":"#/$defs/languageCell"},"Haskell":{"$ref":"#/$defs/languageCell"},"OCaml":{"$ref":"#/$defs/languageCell"},"Erlang/Elixir":{"$ref":"#/$defs/languageCell"},"Lisp/Clojure":{"$ref":"#/$defs/languageCell"},"Smalltalk":{"$ref":"#/$defs/languageCell"},"Prolog":{"$ref":"#/$defs/languageCell"},"APL/J":{"$ref":"#/$defs/languageCell"},"Forth":{"$ref":"#/$defs/languageCell"},"SQL":{"$ref":"#/$defs/languageCell"},"Ada":{"$ref":"#/$defs/languageCell"},"Scala":{"$ref":"#/$defs/languageCell"}},"additionalProperties":false}},"additionalProperties":true,"$defs":{"languageCell":{"type":"object","required":["status","mechanism","sources","versionScope"],"properties":{"status":{"enum":["first-class","partial","emulated","absent-by-design","not-applicable","unknown"]},"mechanism":{"type":"string","minLength":1},"sources":{"type":"array","items":{"type":"string","pattern":"^https?://"}},"versionScope":{"type":"string","minLength":1}},"additionalProperties":false,"allOf":[{"if":{"properties":{"status":{"not":{"const":"unknown"}}}},"then":{"properties":{"sources":{"type":"array","items":{"type":"string","pattern":"^https?://"},"minItems":1}}}}]}}}
