{
  "id": "identity-equality.coercive-equality",
  "clusterId": "identity-equality",
  "name": "Coercive equality",
  "problem": "Inputs arriving as strings and numbers invite convenient comparisons but can silently change types during comparison.",
  "origin": {
    "summary": "Historical priority, inventor and first adoption remain unresolved. The cited primary documentation establishes the described mechanism, not its invention.",
    "confidence": "LOW: historical attribution unverified",
    "sources": []
  },
  "mechanism": "A coercive relation follows type-directed conversions before comparison. A noncoercive relation avoids those conversions; neither should be inferred merely from similar operator spelling.",
  "solutionFamily": "Coercive comparison versus type-sensitive comparison",
  "costs": [
    "Implicit conversions hide surprising pairs.",
    "Normalizing at boundaries requires explicit policy."
  ],
  "transferRule": "Trace operand types and conversion steps before evaluating equality.",
  "confidence": "MEDIUM: mechanism anchored to primary documentation; historical attribution and unknown language cells unresolved; traces are editorial reasoning examples.",
  "sources": [
    "https://tc39.es/ecma262/multipage/abstract-operations.html"
  ],
  "examples": [
    "JavaScript: '2'==2 is true through numeric conversion; '2'===2 is false because the types differ. Compare these before accepting a form value."
  ],
  "counterexamples": [
    "The fact that one numeric string compares equal does not mean loose equality is a universal deep or semantic equality relation."
  ],
  "assessment": {
    "prompt": "A permission value arrives as '0'. Would truthiness and loose equality provide the same validation policy?",
    "rubric": [
      "Separate boolean coercion from equality coercion.",
      "Recommend explicit parsing/validation for the boundary."
    ]
  },
  "languageSupport": {
    "C": {"status": "unknown", "mechanism": "Not verified for this concept; do not infer absence.", "sources": [], "versionScope": "Unverified"},
    "C++": {"status": "unknown", "mechanism": "Not verified for this concept; do not infer absence.", "sources": [], "versionScope": "Unverified"},
    "Rust": {"status": "unknown", "mechanism": "Not verified for this concept; do not infer absence.", "sources": [], "versionScope": "Unverified"},
    "Zig": {"status": "unknown", "mechanism": "Not verified for this concept; do not infer absence.", "sources": [], "versionScope": "Unverified"},
    "Java": {"status": "unknown", "mechanism": "Not verified for this concept; do not infer absence.", "sources": [], "versionScope": "Unverified"},
    "C#": {"status": "unknown", "mechanism": "Not verified for this concept; do not infer absence.", "sources": [], "versionScope": "Unverified"},
    "Kotlin": {"status": "unknown", "mechanism": "Not verified for this concept; do not infer absence.", "sources": [], "versionScope": "Unverified"},
    "Swift": {"status": "unknown", "mechanism": "Not verified for this concept; do not infer absence.", "sources": [], "versionScope": "Unverified"},
    "Go": {"status": "unknown", "mechanism": "Not verified for this concept; do not infer absence.", "sources": [], "versionScope": "Unverified"},
    "Python": {"status": "unknown", "mechanism": "Not verified for this concept; do not infer absence.", "sources": [], "versionScope": "Unverified"},
    "JavaScript": {"status": "first-class", "mechanism": "IsLooselyEqual and IsStrictlyEqual define distinct type-directed comparison behavior.", "sources": ["https://tc39.es/ecma262/multipage/abstract-operations.html"], "versionScope": "ECMAScript living specification snapshot checked 2026-09-05"},
    "TypeScript": {"status": "unknown", "mechanism": "Not verified for this concept; do not infer absence.", "sources": [], "versionScope": "Unverified"},
    "Dart": {"status": "unknown", "mechanism": "Not verified for this concept; do not infer absence.", "sources": [], "versionScope": "Unverified"},
    "Ruby": {"status": "unknown", "mechanism": "Not verified for this concept; do not infer absence.", "sources": [], "versionScope": "Unverified"},
    "PHP": {"status": "unknown", "mechanism": "Not verified for this concept; do not infer absence.", "sources": [], "versionScope": "Unverified"},
    "Haskell": {"status": "unknown", "mechanism": "Not verified for this concept; do not infer absence.", "sources": [], "versionScope": "Unverified"},
    "OCaml": {"status": "unknown", "mechanism": "Not verified for this concept; do not infer absence.", "sources": [], "versionScope": "Unverified"},
    "Erlang/Elixir": {"status": "unknown", "mechanism": "Not verified for this concept; do not infer absence.", "sources": [], "versionScope": "Unverified"},
    "Lisp/Clojure": {"status": "unknown", "mechanism": "Not verified for this concept; do not infer absence.", "sources": [], "versionScope": "Unverified"},
    "Smalltalk": {"status": "unknown", "mechanism": "Not verified for this concept; do not infer absence.", "sources": [], "versionScope": "Unverified"},
    "Prolog": {"status": "unknown", "mechanism": "Not verified for this concept; do not infer absence.", "sources": [], "versionScope": "Unverified"},
    "APL/J": {"status": "unknown", "mechanism": "Not verified for this concept; do not infer absence.", "sources": [], "versionScope": "Unverified"},
    "Forth": {"status": "unknown", "mechanism": "Not verified for this concept; do not infer absence.", "sources": [], "versionScope": "Unverified"},
    "SQL": {"status": "unknown", "mechanism": "Not verified for this concept; do not infer absence.", "sources": [], "versionScope": "Unverified"},
    "Ada": {"status": "unknown", "mechanism": "Not verified for this concept; do not infer absence.", "sources": [], "versionScope": "Unverified"},
    "Scala": {"status": "unknown", "mechanism": "Not verified for this concept; do not infer absence.", "sources": [], "versionScope": "Unverified"}
  }
}
