{
  "id": "identity-equality.reference-identity",
  "clusterId": "identity-equality",
  "name": "Reference identity",
  "problem": "A graph algorithm must distinguish two different nodes that happen to contain equal data.",
  "origin": {
    "summary": "Historical priority, inventor and first adoption remain unresolved. The cited primary documentation establishes the described mechanism, not its invention.",
    "confidence": "LOW: historical attribution unverified",
    "sources": []
  },
  "mechanism": "An identity comparison asks whether references designate the same object rather than comparing its fields. Its lifetime and runtime scope differ from a persistent domain identifier.",
  "solutionFamily": "Object identity versus structural equality",
  "costs": [
    "Identity is usually local to a runtime lifetime.",
    "It does not encode business equivalence."
  ],
  "transferRule": "Ask same object or same meaning before choosing an equality operator.",
  "confidence": "MEDIUM: mechanism anchored to primary documentation; historical attribution and unknown language cells unresolved; traces are editorial reasoning examples.",
  "sources": [
    "https://docs.python.org/3/reference/expressions.html#is-not"
  ],
  "examples": [
    "Python: a=[7]; b=[7]; c=a. a==b is True; a is b is False; a is c is True."
  ],
  "counterexamples": [
    "Two deserialized copies of customer42 can have different object identities while representing the same customer."
  ],
  "assessment": {
    "prompt": "A cycle detector keys visited nodes by a value-equality record. What goes wrong for distinct equal-valued nodes?",
    "rubric": [
      "Explain accidental node merging.",
      "Use object identity or an explicitly unique node ID."
    ]
  },
  "languageSupport": {
    "C": {"status": "unknown", "mechanism": "Not verified for this concept; do not infer absence.", "sources": [], "versionScope": "Unverified"},
    "C++": {"status": "unknown", "mechanism": "Not verified for this concept; do not infer absence.", "sources": [], "versionScope": "Unverified"},
    "Rust": {"status": "unknown", "mechanism": "Not verified for this concept; do not infer absence.", "sources": [], "versionScope": "Unverified"},
    "Zig": {"status": "unknown", "mechanism": "Not verified for this concept; do not infer absence.", "sources": [], "versionScope": "Unverified"},
    "Java": {"status": "unknown", "mechanism": "Not verified for this concept; do not infer absence.", "sources": [], "versionScope": "Unverified"},
    "C#": {"status": "unknown", "mechanism": "Not verified for this concept; do not infer absence.", "sources": [], "versionScope": "Unverified"},
    "Kotlin": {"status": "unknown", "mechanism": "Not verified for this concept; do not infer absence.", "sources": [], "versionScope": "Unverified"},
    "Swift": {"status": "unknown", "mechanism": "Not verified for this concept; do not infer absence.", "sources": [], "versionScope": "Unverified"},
    "Go": {"status": "unknown", "mechanism": "Not verified for this concept; do not infer absence.", "sources": [], "versionScope": "Unverified"},
    "Python": {"status": "first-class", "mechanism": "is compares object identity, while equality is a separate comparison.", "sources": ["https://docs.python.org/3/reference/expressions.html#is-not"], "versionScope": "Python 3.14 documentation snapshot checked 2026-09-05"},
    "JavaScript": {"status": "unknown", "mechanism": "Not verified for this concept; do not infer absence.", "sources": [], "versionScope": "Unverified"},
    "TypeScript": {"status": "unknown", "mechanism": "Not verified for this concept; do not infer absence.", "sources": [], "versionScope": "Unverified"},
    "Dart": {"status": "unknown", "mechanism": "Not verified for this concept; do not infer absence.", "sources": [], "versionScope": "Unverified"},
    "Ruby": {"status": "unknown", "mechanism": "Not verified for this concept; do not infer absence.", "sources": [], "versionScope": "Unverified"},
    "PHP": {"status": "unknown", "mechanism": "Not verified for this concept; do not infer absence.", "sources": [], "versionScope": "Unverified"},
    "Haskell": {"status": "unknown", "mechanism": "Not verified for this concept; do not infer absence.", "sources": [], "versionScope": "Unverified"},
    "OCaml": {"status": "unknown", "mechanism": "Not verified for this concept; do not infer absence.", "sources": [], "versionScope": "Unverified"},
    "Erlang/Elixir": {"status": "unknown", "mechanism": "Not verified for this concept; do not infer absence.", "sources": [], "versionScope": "Unverified"},
    "Lisp/Clojure": {"status": "unknown", "mechanism": "Not verified for this concept; do not infer absence.", "sources": [], "versionScope": "Unverified"},
    "Smalltalk": {"status": "unknown", "mechanism": "Not verified for this concept; do not infer absence.", "sources": [], "versionScope": "Unverified"},
    "Prolog": {"status": "unknown", "mechanism": "Not verified for this concept; do not infer absence.", "sources": [], "versionScope": "Unverified"},
    "APL/J": {"status": "unknown", "mechanism": "Not verified for this concept; do not infer absence.", "sources": [], "versionScope": "Unverified"},
    "Forth": {"status": "unknown", "mechanism": "Not verified for this concept; do not infer absence.", "sources": [], "versionScope": "Unverified"},
    "SQL": {"status": "unknown", "mechanism": "Not verified for this concept; do not infer absence.", "sources": [], "versionScope": "Unverified"},
    "Ada": {"status": "unknown", "mechanism": "Not verified for this concept; do not infer absence.", "sources": [], "versionScope": "Unverified"},
    "Scala": {"status": "unknown", "mechanism": "Not verified for this concept; do not infer absence.", "sources": [], "versionScope": "Unverified"}
  }
}
