{
  "id": "mutability-aliasing.mutex-guarded-mutation",
  "clusterId": "mutability-aliasing",
  "name": "Mutex-guarded mutation",
  "problem": "Several threads must update one compound invariant without interleaving its intermediate steps.",
  "origin": {
    "summary": "Historical priority, inventor and first adoption remain unresolved. The cited primary documentation establishes the described mechanism, not its invention.",
    "confidence": "LOW: historical attribution unverified",
    "sources": []
  },
  "mechanism": "A mutex grants one guard at a time; code mutates protected state while holding the guard and releases on drop. All relevant accesses must follow the same lock protocol.",
  "solutionFamily": "Mutual exclusion versus immutable messages",
  "costs": [
    "Contention blocks progress.",
    "Lock ordering and callback reentrancy can cause deadlocks."
  ],
  "transferRule": "The invariant boundary determines the lock scope, not individual assignment lines.",
  "confidence": "MEDIUM: mechanism anchored to primary documentation; historical attribution and unknown language cells unresolved; traces are editorial reasoning examples.",
  "sources": [
    "https://doc.rust-lang.org/std/sync/struct.Mutex.html"
  ],
  "examples": [
    "Two workers each lock a balance and add1 from initial0. Serial guard ownership produces1 then2; no worker reads0 concurrently under that lock."
  ],
  "counterexamples": [
    "A lock around writes but unlocked reads does not establish a complete synchronization protocol."
  ],
  "assessment": {
    "prompt": "A transfer updates two accounts. How do you avoid both inconsistent totals and opposite-order deadlock?",
    "rubric": [
      "Protect the compound invariant.",
      "Define consistent lock ordering or one aggregate lock."
    ]
  },
  "languageSupport": {
    "C": {"status": "unknown", "mechanism": "Not verified for this concept; do not infer absence.", "sources": [], "versionScope": "Unverified"},
    "C++": {"status": "unknown", "mechanism": "Not verified for this concept; do not infer absence.", "sources": [], "versionScope": "Unverified"},
    "Rust": {"status": "partial", "mechanism": "std::sync::Mutex exposes guards for protected data; poisoning is advisory.", "sources": ["https://doc.rust-lang.org/std/sync/struct.Mutex.html"], "versionScope": "Rust reference/std snapshot checked 2026-09-05"},
    "Zig": {"status": "unknown", "mechanism": "Not verified for this concept; do not infer absence.", "sources": [], "versionScope": "Unverified"},
    "Java": {"status": "unknown", "mechanism": "Not verified for this concept; do not infer absence.", "sources": [], "versionScope": "Unverified"},
    "C#": {"status": "unknown", "mechanism": "Not verified for this concept; do not infer absence.", "sources": [], "versionScope": "Unverified"},
    "Kotlin": {"status": "unknown", "mechanism": "Not verified for this concept; do not infer absence.", "sources": [], "versionScope": "Unverified"},
    "Swift": {"status": "unknown", "mechanism": "Not verified for this concept; do not infer absence.", "sources": [], "versionScope": "Unverified"},
    "Go": {"status": "unknown", "mechanism": "Not verified for this concept; do not infer absence.", "sources": [], "versionScope": "Unverified"},
    "Python": {"status": "unknown", "mechanism": "Not verified for this concept; do not infer absence.", "sources": [], "versionScope": "Unverified"},
    "JavaScript": {"status": "unknown", "mechanism": "Not verified for this concept; do not infer absence.", "sources": [], "versionScope": "Unverified"},
    "TypeScript": {"status": "unknown", "mechanism": "Not verified for this concept; do not infer absence.", "sources": [], "versionScope": "Unverified"},
    "Dart": {"status": "unknown", "mechanism": "Not verified for this concept; do not infer absence.", "sources": [], "versionScope": "Unverified"},
    "Ruby": {"status": "unknown", "mechanism": "Not verified for this concept; do not infer absence.", "sources": [], "versionScope": "Unverified"},
    "PHP": {"status": "unknown", "mechanism": "Not verified for this concept; do not infer absence.", "sources": [], "versionScope": "Unverified"},
    "Haskell": {"status": "unknown", "mechanism": "Not verified for this concept; do not infer absence.", "sources": [], "versionScope": "Unverified"},
    "OCaml": {"status": "unknown", "mechanism": "Not verified for this concept; do not infer absence.", "sources": [], "versionScope": "Unverified"},
    "Erlang/Elixir": {"status": "unknown", "mechanism": "Not verified for this concept; do not infer absence.", "sources": [], "versionScope": "Unverified"},
    "Lisp/Clojure": {"status": "unknown", "mechanism": "Not verified for this concept; do not infer absence.", "sources": [], "versionScope": "Unverified"},
    "Smalltalk": {"status": "unknown", "mechanism": "Not verified for this concept; do not infer absence.", "sources": [], "versionScope": "Unverified"},
    "Prolog": {"status": "unknown", "mechanism": "Not verified for this concept; do not infer absence.", "sources": [], "versionScope": "Unverified"},
    "APL/J": {"status": "unknown", "mechanism": "Not verified for this concept; do not infer absence.", "sources": [], "versionScope": "Unverified"},
    "Forth": {"status": "unknown", "mechanism": "Not verified for this concept; do not infer absence.", "sources": [], "versionScope": "Unverified"},
    "SQL": {"status": "unknown", "mechanism": "Not verified for this concept; do not infer absence.", "sources": [], "versionScope": "Unverified"},
    "Ada": {"status": "unknown", "mechanism": "Not verified for this concept; do not infer absence.", "sources": [], "versionScope": "Unverified"},
    "Scala": {"status": "unknown", "mechanism": "Not verified for this concept; do not infer absence.", "sources": [], "versionScope": "Unverified"}
  }
}
