{
  "id": "mutability-aliasing.interior-mutability",
  "clusterId": "mutability-aliasing",
  "name": "Interior mutability",
  "problem": "A shared handle needs to update controlled internal state without exposing arbitrary mutable access to the whole object.",
  "origin": {
    "summary": "Historical priority, inventor and first adoption remain unresolved. The cited primary documentation establishes the described mechanism, not its invention.",
    "confidence": "LOW: historical attribution unverified",
    "sources": []
  },
  "mechanism": "An interior-mutability abstraction permits selected mutation through a shared reference. UnsafeCell supplies the low-level exception; safe wrappers must enforce their own aliasing and synchronization rules.",
  "solutionFamily": "Encapsulated mutation versus immutable reconstruction",
  "costs": [
    "Correctness moves into the wrapper's invariant.",
    "Some wrappers are single-threaded while others synchronize."
  ],
  "transferRule": "Shared-reference syntax does not by itself prove that all reachable state is immutable.",
  "confidence": "MEDIUM: mechanism anchored to primary documentation; historical attribution and unknown language cells unresolved; traces are editorial reasoning examples.",
  "sources": [
    "https://doc.rust-lang.org/stable/reference/interior-mutability.html"
  ],
  "examples": [
    "Rust: a shared Cell<i32> initially stores1; set(2) replaces its contained integer; another shared handle's get observes2 without producing a shared reference to that integer."
  ],
  "counterexamples": [
    "Interior mutability is not permission to create overlapping mutable references or race across threads."
  ],
  "assessment": {
    "prompt": "A memoizing object exposes only shared methods. Explain how it could mutate safely and which evidence is still needed.",
    "rubric": [
      "Name an interior-mutability abstraction.",
      "Specify its alias/thread boundary rather than treating shared as deeply immutable."
    ]
  },
  "languageSupport": {
    "C": {"status": "unknown", "mechanism": "Not verified for this concept; do not infer absence.", "sources": [], "versionScope": "Unverified"},
    "C++": {"status": "unknown", "mechanism": "Not verified for this concept; do not infer absence.", "sources": [], "versionScope": "Unverified"},
    "Rust": {"status": "partial", "mechanism": "UnsafeCell underlies library abstractions allowing mutation through shared references.", "sources": ["https://doc.rust-lang.org/stable/reference/interior-mutability.html"], "versionScope": "Rust reference/std snapshot checked 2026-09-05"},
    "Zig": {"status": "unknown", "mechanism": "Not verified for this concept; do not infer absence.", "sources": [], "versionScope": "Unverified"},
    "Java": {"status": "unknown", "mechanism": "Not verified for this concept; do not infer absence.", "sources": [], "versionScope": "Unverified"},
    "C#": {"status": "unknown", "mechanism": "Not verified for this concept; do not infer absence.", "sources": [], "versionScope": "Unverified"},
    "Kotlin": {"status": "unknown", "mechanism": "Not verified for this concept; do not infer absence.", "sources": [], "versionScope": "Unverified"},
    "Swift": {"status": "unknown", "mechanism": "Not verified for this concept; do not infer absence.", "sources": [], "versionScope": "Unverified"},
    "Go": {"status": "unknown", "mechanism": "Not verified for this concept; do not infer absence.", "sources": [], "versionScope": "Unverified"},
    "Python": {"status": "unknown", "mechanism": "Not verified for this concept; do not infer absence.", "sources": [], "versionScope": "Unverified"},
    "JavaScript": {"status": "unknown", "mechanism": "Not verified for this concept; do not infer absence.", "sources": [], "versionScope": "Unverified"},
    "TypeScript": {"status": "unknown", "mechanism": "Not verified for this concept; do not infer absence.", "sources": [], "versionScope": "Unverified"},
    "Dart": {"status": "unknown", "mechanism": "Not verified for this concept; do not infer absence.", "sources": [], "versionScope": "Unverified"},
    "Ruby": {"status": "unknown", "mechanism": "Not verified for this concept; do not infer absence.", "sources": [], "versionScope": "Unverified"},
    "PHP": {"status": "unknown", "mechanism": "Not verified for this concept; do not infer absence.", "sources": [], "versionScope": "Unverified"},
    "Haskell": {"status": "unknown", "mechanism": "Not verified for this concept; do not infer absence.", "sources": [], "versionScope": "Unverified"},
    "OCaml": {"status": "unknown", "mechanism": "Not verified for this concept; do not infer absence.", "sources": [], "versionScope": "Unverified"},
    "Erlang/Elixir": {"status": "unknown", "mechanism": "Not verified for this concept; do not infer absence.", "sources": [], "versionScope": "Unverified"},
    "Lisp/Clojure": {"status": "unknown", "mechanism": "Not verified for this concept; do not infer absence.", "sources": [], "versionScope": "Unverified"},
    "Smalltalk": {"status": "unknown", "mechanism": "Not verified for this concept; do not infer absence.", "sources": [], "versionScope": "Unverified"},
    "Prolog": {"status": "unknown", "mechanism": "Not verified for this concept; do not infer absence.", "sources": [], "versionScope": "Unverified"},
    "APL/J": {"status": "unknown", "mechanism": "Not verified for this concept; do not infer absence.", "sources": [], "versionScope": "Unverified"},
    "Forth": {"status": "unknown", "mechanism": "Not verified for this concept; do not infer absence.", "sources": [], "versionScope": "Unverified"},
    "SQL": {"status": "unknown", "mechanism": "Not verified for this concept; do not infer absence.", "sources": [], "versionScope": "Unverified"},
    "Ada": {"status": "unknown", "mechanism": "Not verified for this concept; do not infer absence.", "sources": [], "versionScope": "Unverified"},
    "Scala": {"status": "unknown", "mechanism": "Not verified for this concept; do not infer absence.", "sources": [], "versionScope": "Unverified"}
  }
}
